LinkGmaps,NameLocation,Rating,Foto,Provinsi,Alamat,Penjelasan,Kategori
https://www.google.com/maps/place/Taman+Nasional+Tanjung+Puting/data=!4m7!3m6!1s0x2e09a5fcc9bb3c5d:0xddb88e3644e9ea03!8m2!3d-3.0550149!4d111.9184136!16s%2Fm%2F06w61t2!19sChIJXTy7yfylCS4RA-rpRDaOuN0?authuser=0&hl=id&rclk=1,Taman Nasional Tanjung Puting,"4,7",https://lh5.googleusercontent.com/p/AF1QipMgGaOpOgz5CAXIUFLG8iflQ9x1uFfaMursloME=w1220-h920-k-no,Kalimantan Tengah,"Kecamatan Kumai, Kabupaten Kotawaringin Barat","Taman Nasional Tanjung Puting adalah salah satu taman nasional terpenting di Indonesia dan dikenal sebagai pusat konservasi orangutan terbesar di dunia. Terletak di semenanjung barat daya Kalimantan Tengah, taman ini memiliki luas sekitar 415.040 hektare dan terdiri dari berbagai ekosistem, termasuk hutan tropis dataran rendah, hutan rawa gambut, dan mangrove. Taman ini terkenal dengan keanekaragaman hayatinya, termasuk berbagai spesies mamalia seperti bekantan, owa Kalimantan, dan beruang madu. Salah satu atraksi utama di taman ini adalah Camp Leakey, tempat rehabilitasi orangutan yang memungkinkan pengunjung untuk menyaksikan orangutan dari dekat saat mereka diberi makan. Pengunjung dapat menjelajahi taman dengan menggunakan kapal kelotok menyusuri sungai-sungai yang ada.",Hutan/Taman Nasional
https://www.google.com/maps/place/Wisata+Bukit+Batu+Pertapaan+Tjilik+Riwut/data=!4m7!3m6!1s0x2dfce3fd223cf5d5:0xcb4e6c653c6fae85!8m2!3d-1.8951303!4d113.4680533!16s%2Fg%2F11c2np7d7b!19sChIJ1fU8Iv3j_C0Rha5vPGVsTss?authuser=0&hl=id&rclk=1,Wisata Bukit Batu Pertapaan Tjilik Riwut,"4,4",https://lh5.googleusercontent.com/p/AF1QipOxjbiOSog4FYDOVMJjoD8OnouzQeRQWqkNj3XR=w1220-h920-k-no,Kalimantan Tengah,"Kecamatan Tjilik Riwut, Kabupaten Pulang Pisau","Wisata Bukit Batu Pertapaan Tjilik Riwut adalah lokasi yang menawarkan pemandangan alam yang menakjubkan serta nilai spiritual bagi masyarakat setempat. Bukit ini dikenal sebagai tempat pertapaan yang sering dikunjungi oleh para peziarah dan wisatawan yang ingin merasakan kedamaian dan keindahan alam. Dari puncaknya, pengunjung dapat menikmati panorama luas hutan dan sungai yang mengalir di sekitarnya. Tempat ini juga sering dijadikan lokasi untuk kegiatan meditasi dan refleksi diri.",Gunung/Bukit
https://www.google.com/maps/place/Taman+Pasuk+Kameloh/data=!4m7!3m6!1s0x2dfcb25b32fffff3:0x14e6945a5735c40b!8m2!3d-2.2036369!4d113.92046!16s%2Fg%2F11f3n1ybkd!19sChIJ8___Mluy_C0RC8Q1V1qU5hQ?authuser=0&hl=id&rclk=1,Taman Pasuk Kameloh,"4,5",https://lh5.googleusercontent.com/p/AF1QipNKlqbcDjVIdgARm_jl9KVEsfm-303X1f-n_Dw6=w1220-h920-k-no,Kalimantan Tengah,"Kecamatan Palangka Raya, Kota Palangka Raya","Taman Pasuk Kameloh adalah taman rekreasi yang dirancang untuk memberikan ruang terbuka hijau bagi masyarakat Palangka Raya. Taman ini dilengkapi dengan jalur jogging, area bermain anak-anak, serta spot untuk bersantai sambil menikmati udara segar. Suasana taman sangat hidup terutama pada akhir pekan ketika banyak acara komunitas berlangsung di sini. Taman Pasuk Kameloh menjadi pilihan populer bagi mereka yang ingin bersantai sambil menikmati aktivitas sosial masyarakat kota.",Taman Rekreasi
https://www.google.com/maps/place/Matan+Andau+Tangkiling/data=!4m7!3m6!1s0x2dfcc19cb77ef39d:0x7448e16e2ecb9c29!8m2!3d-1.9978901!4d113.7388188!16s%2Fg%2F11k3_lzvbk!19sChIJnfN-t5zB_C0RKZzLLm7hSHQ?authuser=0&hl=id&rclk=1,Matan Andau Tangkiling,"4,0",https://lh5.googleusercontent.com/p/AF1QipO0bhYENBhz1aScSJn8mCGP20n38VwiDAcMoLKD=w1220-h920-k-no,Kalimantan Tengah,"Kecamatan Tangkiling, Kabupaten Pulang Pisau","Matan Andau Tangkiling adalah destinasi wisata alam yang menawarkan pemandangan hutan tropis serta keindahan alam yang asri. Tempat ini menjadi lokasi ideal untuk kegiatan trekking dan camping bagi pecinta alam. Dengan akses yang relatif mudah dari pusat kota Palangka Raya, Matan Andau Tangkiling menjadi pilihan menarik bagi mereka yang ingin menikmati keindahan alam sekaligus bersantai dari kesibukan sehari-hari",Lainnya
https://www.google.com/maps/place/Pesona+Alam+Lestari/data=!4m7!3m6!1s0x2de34c42aaf9566f:0xf1cd1e425dcd2098!8m2!3d-2.295615!4d113.8825728!16s%2Fg%2F11cjqlpfcy!19sChIJb1b5qkJM4y0RmCDNXUIezfE?authuser=0&hl=id&rclk=1,Pesona Alam Lestari,"3,9",https://lh5.googleusercontent.com/p/AF1QipO6mnUapjWoaSpgsFRDEhPEIgSki95sEzxJUnZy=w1220-h920-k-no,Kalimantan Tengah,"Kecamatan Palangka Raya, Kota Palangka Raya","Pesona Alam Lestari adalah kawasan wisata yang menawarkan keindahan alam serta berbagai aktivitas luar ruangan seperti hiking dan berkemah. Dikelilingi oleh hutan tropis yang rimbun, tempat ini cocok untuk keluarga atau kelompok yang ingin menghabiskan waktu berkualitas di tengah alam. Dengan fasilitas sederhana namun memadai, Pesona Alam Lestari menjadi pilihan menarik bagi para pecinta alam.",Lainnya
https://www.google.com/maps/place/Wisata+Flamboyan+Bawah/data=!4m7!3m6!1s0x2dfcb25d0b4e04a1:0x95434676cfed53be!8m2!3d-2.2059777!4d113.9285418!16s%2Fg%2F11c66pffjg!19sChIJoQROC12y_C0RvlPtz3ZGQ5U?authuser=0&hl=id&rclk=1,Wisata Flamboyan Bawah,"4,2",https://lh5.googleusercontent.com/p/AF1QipPc_t_9XbD5j4tH4AbnA0b8jV-2eo3lIJ3zZER-=w1220-h920-k-no,Kalimantan Tengah,"Kecamatan Palangka Raya, Kota Palangka Raya","Wisata Flamboyan Bawah adalah area rekreasi yang terkenal dengan pohon flamboyan yang indah dan berwarna-warni saat berbunga. Tempat ini menjadi lokasi favorit bagi masyarakat setempat untuk bersantai sambil menikmati keindahan alam dan suasana tenang. Dengan berbagai fasilitas seperti jalur pejalan kaki dan area bermain anak-anak, Wisata Flamboyan Bawah menjadi pilihan ideal untuk piknik keluarga atau sekadar menikmati sore hari bersama teman-teman.",Taman Rekreasi
https://www.google.com/maps/place/Taman+Wisata+Alam+Bukit+Tangkiling/data=!4m7!3m6!1s0x2dfcc07d6e7bda0b:0x58827bd130bff911!8m2!3d-1.9986201!4d113.75346!16s%2Fg%2F11cp7p__gh!19sChIJC9p7bn3A_C0REfm_MNF7glg?authuser=0&hl=id&rclk=1,Taman Wisata Alam Bukit Tangkiling,"4,2",https://lh5.googleusercontent.com/p/AF1QipMBAWIw6q1qaMnkye3zE0bYHcohHkM2g0DFJhwI=w1220-h920-k-no,Kalimantan Tengah,"Kecamatan Tangkiling, Kabupaten Pulang Pisau",Taman Wisata Alam Bukit Tangkiling adalah kawasan konservasi yang menawarkan pemandangan indah serta jalur trekking menarik bagi para pecinta alam. Di sini pengunjung dapat menjelajahi hutan tropis sambil menikmati keindahan flora dan fauna lokal. Tempat ini juga sering dijadikan lokasi penelitian serta kegiatan ekowisata bagi pelajar dan peneliti lingkungan. Suasana sejuk di sekitar bukit menjadikannya tempat ideal untuk beraktivitas outdoor.,Hutan/Taman Nasional
https://www.google.com/maps/place/Air+Terjun+Batu+Mahasur/data=!4m7!3m6!1s0x2dfea0ca5b95aa3f:0x7287419dfd2b8e5f!8m2!3d-1.0897524!4d113.8549018!16s%2Fg%2F11c1n8fdh9!19sChIJP6qVW8qg_i0RX44r_Z1Bh3I?authuser=0&hl=id&rclk=1,Air Terjun Batu Mahasur,"4,2",https://lh5.googleusercontent.com/p/AF1QipMnzCMcas54iIjKgr3b95RdoDCeAA-xkTP1v6bA=w1220-h920-k-no,Kalimantan Tengah,"Kecamatan Katingan Hilir, Kabupaten Katingan",Air Terjun Batu Mahasur adalah air terjun menakjubkan dengan aliran air jernih yang jatuh dari ketinggian ke kolam alami di bawahnya. Dikelilingi oleh hutan lebat membuat suasana di sekitar air terjun sangat damai dan tenang bagi para pengunjungnya. Akses menuju lokasi memerlukan trekking melalui jalur alami namun memberikan pengalaman petualangan tersendiri saat tiba di tujuan.,Air Terjun
https://www.google.com/maps/place/Pantai+Kubu/data=!4m7!3m6!1s0x2e08fd0dd7c616bf:0x99e9ac20df07075d!8m2!3d-2.8579946!4d111.7010427!16s%2Fg%2F11f2tgp5sh!19sChIJvxbG1w39CC4RXQcH3yCs6Zk?authuser=0&hl=id&rclk=1,Pantai Kubu,"4,2",https://lh5.googleusercontent.com/p/AF1QipO7iNT4JcP3cUjZrtFi1Dng9S8X2-fOCkjZgX2q=w1220-h920-k-no,Kalimantan Tengah,"Kecamatan Kubu Raya, Kabupaten Kubu Raya",Pantai Kubu adalah pantai indah dengan pasir putih bersih dan ombak yang tenang. Tempat ini sangat cocok untuk bersantai sambil menikmati pemandangan laut lepas serta melakukan aktivitas seperti berenang dan bermain pasir. Pantai ini juga dikelilingi oleh pepohonan hijau yang memberikan suasana sejuk dan nyaman bagi pengunjungnya.,Pantai
https://www.google.com/maps/place/Taman+Nasional+Sebangau/data=!4m7!3m6!1s0x2dfcb2f9109ee879:0x40114385e9a1ba41!8m2!3d-2.5973765!4d113.6737776!16s%2Fm%2F04yfxmp!19sChIJeeieEPmy_C0RQbqh6YVDEUA?authuser=0&hl=id&rclk=1,Taman Nasional Sebangau,"4,3",https://lh5.googleusercontent.com/p/AF1QipNwgozK8iwPH6LR6Pat3ELH4kfZ-PcQdYNRhrpe=w1220-h920-k-no,Kalimantan Tengah,"Kecamatan Sebangau, Kota Palangka Raya",Taman Nasional Sebangau merupakan kawasan konservasi penting di Kalimantan Tengah dengan ekosistem gambut yang kaya akan flora dan fauna langka. Di sini pengunjung dapat menemukan berbagai spesies satwa liar seperti orangutan dan bekantan dalam habitat aslinya. Kawasan ini juga menawarkan aktivitas ekowisata seperti trekking dan birdwatching bagi para pengunjungnya.,Hutan/Taman Nasional
https://www.google.com/maps/place/Wisata+Lewu+Bue/data=!4m7!3m6!1s0x2dfcb30038d88961:0xa846c57dda8d872b!8m2!3d-1.9324759!4d113.7249119!16s%2Fg%2F11pw8mzz7b!19sChIJYYnYOACz_C0RK4eN2n3FRqg?authuser=0&hl=id&rclk=1,Wisata Lewu Bue,"4,5",https://lh5.googleusercontent.com/p/AF1QipMOXa8AY43zt1Jcrve1kXv7XEOnO8YekAKPHsno=w1220-h920-k-no,Kalimantan Tengah,"Kecamatan Bukit Batu, Kota Palangka Raya","Wisata Lewu Bue, juga dikenal sebagai Kampung Kakek, adalah destinasi wisata baru yang menawarkan pemandangan alam yang menakjubkan dengan pondok-pondok yang terletak di tepi danau. Danau ini memiliki air hitam yang jernih dan bersih, dikelilingi oleh hutan gambut yang kaya akan keanekaragaman hayati. Pengunjung dapat menikmati berbagai aktivitas seperti berkemah, memancing, dan bersantai di area piknik yang telah disediakan. Selain itu, tempat ini juga menjadi lokasi favorit untuk berfoto karena keindahan alamnya. Dengan fasilitas yang memadai dan suasana yang tenang, Wisata Lewu Bue menjadi pilihan menarik bagi masyarakat setempat dan wisatawan untuk menghabiskan waktu liburan.",Lainnya
https://www.google.com/maps/place/Wisata+Alam+Jurung+Tiga/data=!4m7!3m6!1s0x2e08e54ef3461865:0x38bce3540f08b457!8m2!3d-2.7738726!4d111.657257!16s%2Fg%2F11fj7pmnlz!19sChIJZRhG807lCC4RV7QID1TjvDg?authuser=0&hl=id&rclk=1,Wisata Alam Jurung Tiga,"4,2",https://lh5.googleusercontent.com/p/AF1QipMQ8xqhfLjO4MgdrChpPfKaPyekVXbZKhTp7hNm=w1220-h920-k-no,Kalimantan Tengah,"Kecamatan Palangka Raya, Kota Palangka Raya","Wisata Alam Jurung Tiga adalah kawasan wisata alam yang menawarkan keindahan hutan tropis serta berbagai aktivitas luar ruangan. Tempat ini cocok untuk trekking dan eksplorasi alam bagi para pecinta petualangan. Dengan jalur-jalur yang telah ditentukan, pengunjung dapat menikmati pemandangan flora dan fauna lokal serta merasakan kedamaian jauh dari keramaian kota. Suasana alami di Jurung Tiga memberikan pengalaman berharga bagi siapa saja yang ingin menjelajahi keindahan alam Kalimantan Tengah.",Hutan/Taman Nasional
https://www.google.com/maps/place/Pantai+Keraya/data=!4m7!3m6!1s0x2e0919e152c11bc9:0x29dcbbfad4c418f2!8m2!3d-2.9886728!4d111.533358!16s%2Fg%2F11s3qxxlrk!19sChIJyRvBUuEZCS4R8hjE1Pq73Ck?authuser=0&hl=id&rclk=1,Pantai Keraya,"4,5",https://lh5.googleusercontent.com/p/AF1QipMdMD7BlMfe9LodghD_yh6bPjV-0USVkqeuYyI=w1220-h920-k-no,Kalimantan Tengah,"Kecamatan Keraya, Kabupaten Kotawaringin Barat",Pantai Keraya adalah pantai yang menawarkan pemandangan laut yang indah dengan pasir putih bersih. Tempat ini sangat cocok untuk bersantai sambil menikmati angin laut dan suara ombak. Pantai ini juga menyediakan fasilitas untuk kegiatan seperti berenang dan bermain pasir. Suasana tenang dan asri menjadikan Pantai Keraya pilihan menarik bagi wisatawan lokal maupun mancanegara untuk menghabiskan waktu liburan mereka di tepi laut.,Pantai
https://www.google.com/maps/place/Manasa+Agrowisata/data=!4m7!3m6!1s0x2dfcc1050b385613:0x62c799390faccbd9!8m2!3d-2.0043582!4d113.7489855!16s%2Fg%2F11nmpnzcdm!19sChIJE1Y4CwXB_C0R2cusDzmZx2I?authuser=0&hl=id&rclk=1,Manasa Agrowisata,"4,5",https://lh5.googleusercontent.com/p/AF1QipPPYvt9s5DUtJXowgYiKar27MKJ3p98XSa1xPeo=w1220-h920-k-no,Kalimantan Tengah,"Kecamatan Pangkalan Bun, Kabupaten Kotawaringin Barat","Manasa Agrowisata adalah destinasi wisata berbasis pertanian yang menawarkan pengalaman belajar tentang pertanian organik serta produk lokal. Di sini, pengunjung dapat berpartisipasi dalam kegiatan berkebun serta menikmati hasil panen segar langsung dari kebun. Tempat ini juga menyediakan fasilitas untuk bersantai dan menikmati pemandangan alam sekitar yang indah. Manasa Agrowisata menjadi pilihan menarik bagi keluarga yang ingin menghabiskan waktu sambil belajar tentang pertanian dan lingkungan hidup secara langsung.",Taman Rekreasi
https://www.google.com/maps/place/Pangkalan+Bun+Park/data=!4m7!3m6!1s0x2e08efea21fed607:0x4df864dd87a19d33!8m2!3d-2.7126607!4d111.6467813!16s%2Fg%2F11b6b49x4g!19sChIJB9b-IervCC4RM52hh91k-E0?authuser=0&hl=id&rclk=1,Pangkalan Bun Park,"4,2",https://lh5.googleusercontent.com/p/AF1QipNd4m9UVA4ZC4EhTmFMT6jpL0O_KnJioetvYs7G=w1220-h920-k-no,Kalimantan Tengah,"Pangkalan Bun, Kabupaten Kotawaringin Barat","Pangkalan Bun Park adalah taman kota yang dirancang untuk memberikan ruang terbuka hijau bagi masyarakat setempat. Taman ini dilengkapi dengan area bermain anak-anak, jalur jogging, serta spot untuk bersantai sambil menikmati pemandangan taman yang asri. Suasana taman sangat hidup terutama pada akhir pekan ketika banyak acara komunitas berlangsung di sini. Pangkalan Bun Park menjadi pilihan populer bagi mereka yang ingin bersantai sambil menikmati aktivitas sosial masyarakat kota Pangkalan Bun",Taman Rekreasi
https://www.google.com/maps/place/Pantai+Tebing+kalap/data=!4m7!3m6!1s0x2de217e516c3e2ef:0x5c714de7d17eac8e!8m2!3d-3.2288551!4d112.9305039!16s%2Fg%2F11rdb6nv96!19sChIJ7-LDFuUX4i0Rjqx-0edNcVw?authuser=0&hl=id&rclk=1,Pantai Tebing kalap,"4,5",https://lh5.googleusercontent.com/p/AF1QipNasaeTNhcP4Uc6Lo-EXHPNdq4k8WLw-cZSnRK0=w1220-h920-k-no,Kalimantan Tengah,"Kecamatan Katingan Hilir, Kabupaten Katingan",Pantai Tebing Kalap adalah pantai indah dengan tebing-tebing curam di sekitarnya yang menawarkan pemandangan spektakuler. Tempat ini sangat cocok untuk bersantai sambil menikmati pemandangan laut lepas serta melakukan aktivitas seperti berenang dan bermain pasir. Suasana sejuk dan angin laut membuat pantai ini menjadi tempat ideal untuk menghabiskan waktu liburan bersama keluarga atau teman-teman.,Pantai
https://www.google.com/maps/place/Kawasan+Wisata+Kereng+Bengkirai/data=!4m7!3m6!1s0x2de34db1c2897713:0xfbde4796da76bac3!8m2!3d-2.2960709!4d113.9048616!16s%2Fg%2F11m_v_yc6z!19sChIJE3eJwrFN4y0Rw7p22pZH3vs?authuser=0&hl=id&rclk=1,Kawasan Wisata Kereng Bengkirai,"4,7",https://lh5.googleusercontent.com/p/AF1QipP4LWTlVOsRw72U06JlKvFeUhTK4XBgysgywiX6=w1220-h920-k-no,Kalimantan Tengah,"Kecamatan Sebangau Kuala, Kota Palangka Raya","Kawasan Wisata Kereng Bengkirai adalah area rekreasi yang menawarkan keindahan alam serta berbagai aktivitas luar ruangan seperti hiking dan berkemah. Dikelilingi oleh hutan tropis yang rimbun, tempat ini cocok untuk keluarga atau kelompok yang ingin menghabiskan waktu berkualitas di tengah alam.",Hutan/Taman Nasional
https://www.google.com/maps/place/Wisata+Danau+Tahai/data=!4m7!3m6!1s0x2dfcbf4f1cb6a2b9:0xc24a71d25fa4b612!8m2!3d-2.0280831!4d113.7789272!16s%2Fg%2F11f29znpqt!19sChIJuaK2HE-__C0RErakX9JxSsI?authuser=0&hl=id&rclk=1,Wisata Danau Tahai,"3,9",https://lh5.googleusercontent.com/p/AF1QipMuBy5ZKH2Yir2mm900J9PyD2fUJWlPy_bUdZe3=w1220-h920-k-no,Kalimantan Tengah,"Kecamatan Palangka Raya, Kota Palangka Raya",Wisata Danau Tahai adalah destinasi wisata alam dengan pemandangan indah serta suasana tenang dikelilingi oleh hutan tropis. Danau ini menjadi habitat bagi berbagai jenis burung serta satwa liar lainnya dan merupakan tempat ideal untuk pengamat burung serta pecinta alam. Pengunjung dapat melakukan aktivitas seperti memancing atau sekadar bersantai menikmati keindahan alam sekitar.,Danau
https://www.google.com/maps/place/Pantai+jodoh/data=!4m7!3m6!1s0x2de2179c7dbb0877:0x606b61e8d719d5a8!8m2!3d-3.224228!4d112.9395966!16s%2Fg%2F11sxvwfy3j!19sChIJdwi7fZwX4i0RqNUZ1-hha2A?authuser=0&hl=id&rclk=1,Pantai jodoh,"4,5",https://lh5.googleusercontent.com/p/AF1QipMo9Y4Itr4oTuN8raXgdccEhjuZhrVi1E8DLRRT=w1220-h920-k-no,Kalimantan Tengah,"Kecamatan Teluk Sampit, Kabupaten Kotawaringin Timur","Pantai Jodoh adalah destinasi wisata baru yang terletak di Desa Ujung Pandaran, terkenal dengan hamparan pantai yang luas dan air laut yang jernih. Tempat ini menawarkan suasana tenang dan pemandangan alam yang menakjubkan, menjadikannya pilihan ideal untuk bersantai dan menikmati keindahan pantai. Pengunjung dapat melakukan berbagai aktivitas seperti berenang, bermain pasir, atau sekadar menikmati pemandangan sambil bersantai di tepi pantai. Camat Teluk Sampit, Dedi Purwanto, mengajak masyarakat untuk menjaga kebersihan pantai dan keasriannya agar tetap terjaga. Pantai Jodoh juga sering dikunjungi oleh wisatawan lokal maupun mancanegara yang ingin merasakan keindahan alam Kalimantan Tengah.",Pantai
https://www.google.com/maps/place/Kampung+sega/data=!4m7!3m6!1s0x2e08ef7b20907559:0xce110169c72bc01a!8m2!3d-2.6769829!4d111.6264709!16s%2Fg%2F11r4xpkmwd!19sChIJWXWQIHvvCC4RGsArx2kBEc4?authuser=0&hl=id&rclk=1,Kampung sega,"4,5",https://lh5.googleusercontent.com/p/AF1QipPJCVkhAPoeWgEEBa08u261gACfbh9fznfV2QLe=w1220-h920-k-no,Kalimantan Tengah,"Kecamatan Barito Selatan, Kabupaten Barito Selatan","Kampung Sega adalah desa wisata yang menawarkan pengalaman budaya lokal dan keindahan alam di Kalimantan Tengah. Di sini, pengunjung dapat merasakan kehidupan sehari-hari masyarakat setempat yang masih kental dengan tradisi dan budaya Dayak. Kampung ini juga dikenal dengan kerajinan tangan yang dihasilkan oleh penduduknya, seperti anyaman dan ukiran kayu. Selain itu, pengunjung dapat menikmati pemandangan alam yang indah serta berinteraksi langsung dengan masyarakat lokal. Kegiatan yang ditawarkan termasuk tur budaya, pertunjukan seni, dan eksplorasi alam sekitar. Dengan suasana yang ramah dan alami, Kampung Sega menjadi pilihan menarik bagi wisatawan yang ingin merasakan kedalaman budaya Kalimantan.",Desa Wisata
https://www.google.com/maps/place/Gunung+Usung/data=!4m7!3m6!1s0x2df91bc4e6fa631b:0xed33cb130626a05d!8m2!3d-0.6390191!4d114.6328796!16s%2Fg%2F11c5_8s1ry!19sChIJG2P65sQb-S0RXaAmBhPLM-0?authuser=0&hl=id&rclk=1,Gunung Usung,"4,1",https://lh5.googleusercontent.com/p/AF1QipM0QLO4-OSyVw8quc3yYHtduYPQykUsjLhb_yTz=w1220-h920-k-no,Kalimantan Tengah,"Kecamatan Gunung Mas, Kabupaten Gunung Mas","Gunung Usung adalah salah satu gunung yang menawarkan pemandangan alam menakjubkan serta jalur pendakian menarik bagi para pecinta hiking. Dari puncaknya, pengunjung dapat menikmati panorama luas pegunungan dan hutan tropis Kalimantan Tengah. Tempat ini sering dijadikan lokasi untuk kegiatan outdoor seperti trekking dan camping, menjadikannya pilihan menarik bagi mereka yang ingin merasakan keindahan alam jauh dari keramaian kota besar.",Gunung/Bukit
https://www.google.com/maps/place/Danau+Hanjalutung/data=!4m7!3m6!1s0x2dfcb0c9a816414b:0xbea115099e173e98!8m2!3d-2.1259897!4d113.8667393!16s%2Fg%2F11c72x9fdv!19sChIJS0EWqMmw_C0RmD4XngkVob4?authuser=0&hl=id&rclk=1,Danau Hanjalutung,"4,5",https://lh5.googleusercontent.com/p/AF1QipPx7NupyaGRHTwHFULmJpGoV8ERfzWK2nGHodmC=w1220-h920-k-no,Kalimantan Tengah,"Kecamatan Hanjalutung, Kabupaten Barito Timur",Danau Hanjalutung adalah destinasi wisata alam yang menawarkan pemandangan indah serta suasana tenang dikelilingi oleh hutan tropis. Danau ini menjadi habitat bagi berbagai jenis burung serta satwa liar lainnya dan merupakan tempat ideal untuk pengamat burung serta pecinta alam. Pengunjung dapat melakukan aktivitas seperti memancing atau sekadar bersantai menikmati keindahan alam sekitar.,Danau
https://www.google.com/maps/place/Terowongan+NUR+MENTAYA/data=!4m7!3m6!1s0x2de2bf59f5438687:0x5ea67611b71ae14d!8m2!3d-2.5057446!4d112.9600468!16s%2Fg%2F11kj_ktzhn!19sChIJh4ZD9Vm_4i0RTeEatxF2pl4?authuser=0&hl=id&rclk=1,Terowongan NUR MENTAYA,"4,5",https://lh5.googleusercontent.com/p/AF1QipMekCsbh_l5jMDaJHz4GV59QFWAup17PP2JVyUC=w1220-h920-k-no,Kalimantan Tengah,"Kecamatan Mentaya Hilir Selatan, Kabupaten Kotawaringin Timur","Terowongan NUR MENTAYA adalah salah satu objek wisata unik yang terletak di tepi Sungai Mentaya. Terowongan ini merupakan hasil karya seni arsitektur yang menghubungkan dua sisi sungai dan menjadi daya tarik bagi pengunjung untuk berfoto dan menikmati pemandangan sungai. Suasana di sekitar terowongan sangat tenang dan asri, menjadikannya tempat ideal untuk bersantai sambil menikmati keindahan alam. Terowongan ini juga sering digunakan sebagai lokasi acara komunitas dan festival lokal.",Lainnya
https://www.google.com/maps/place/Lewu+Betang+Nansarunai+Sanggu/data=!4m7!3m6!1s0x2dfa5505bdac647f:0x1e4f2bdc5ac543e1!8m2!3d-1.6571984!4d114.9265925!16s%2Fg%2F11fmwskw8f!19sChIJf2SsvQVV-i0R4UPFWtwrTx4?authuser=0&hl=id&rclk=1,Lewu Betang Nansarunai Sanggu,"4,4",https://lh5.googleusercontent.com/p/AF1QipNKAcda6tH14kquRq1OkHNXgoHmkusmKMzQ6I0Q=w1220-h920-k-no,Kalimantan Tengah,"Kecamatan Dusun Selatan, Kabupaten Barito Selatan","Lewu Betang Nansarunai adalah objek wisata yang mengusung tema alam terbuka dengan nuansa etnik Dayak. Didirikan pada tahun 2019, tempat ini menawarkan berbagai fasilitas seperti villa untuk penginapan, gazebo, serta wahana permainan seperti fly fox dan ATV. Selain menjadi tempat wisata, Lewu Betang juga berfungsi sebagai pusat kerajinan tangan dari kayu yang memiliki nilai ekonomi tinggi. Lokasi ini sering dijadikan tempat kegiatan fun camp oleh berbagai organisasi serta acara komunitas lainnya. Pengunjung dapat menikmati keindahan alam sambil belajar tentang budaya lokal di sini.",Desa Wisata
https://www.google.com/maps/place/Air+Terjun+Tosah+puruk+cahu/data=!4m7!3m6!1s0x2df9146fb1eb46e9:0x958ef9e936c723c1!8m2!3d-0.778244!4d114.6052749!16s%2Fg%2F11c2qfy635!19sChIJ6UbrsW8U-S0RwSPHNun5jpU?authuser=0&hl=id&rclk=1,Air Terjun Tosah puruk cahu,"4,5",https://lh5.googleusercontent.com/p/AF1QipP5yo8AUD2yBRO3r_cTkpRF__YU8yBilyEmZAEr=w1220-h920-k-no,Kalimantan Tengah,"Kecamatan Puruk Cahu, Kabupaten Murung Raya",Air Terjun Tosah adalah salah satu air terjun tersembunyi di Murung Raya dengan aliran air jernih yang jatuh dari ketinggian ke kolam alami di bawahnya. Dikelilingi oleh hutan lebat membuat suasana di sekitar air terjun sangat damai dan tenang bagi para pengunjungnya. Akses menuju lokasi memerlukan trekking melalui jalur alami namun memberikan pengalaman petualangan tersendiri saat tiba di tujuan.,Air Terjun
https://www.google.com/maps/place/Desa+Wisata+Hurung+Bunut/data=!4m7!3m6!1s0x2dfc1a64b43200bd:0x930954ac401c8ccb!8m2!3d-1.240057!4d113.898835!16s%2Fg%2F11c2nb23bl!19sChIJvQAytGQa_C0Ry4wcQKxUCZM?authuser=0&hl=id&rclk=1,Desa Wisata Hurung Bunut,"4,1",https://lh5.googleusercontent.com/p/AF1QipN-5VzPG1x4CfCOzJdRrmvR8G8PZpLUbayDE5Jr=w1220-h920-k-no,Kalimantan Tengah,"Kecamatan Buntok, Kabupaten Barito Selatan","Desa Wisata Hurung Bunut menawarkan pengalaman budaya lokal dan keindahan alam kepada para pengunjung. Di sini, wisatawan dapat merasakan kehidupan sehari-hari masyarakat setempat serta berinteraksi langsung dengan penduduk desa. Kegiatan yang ditawarkan termasuk tur budaya, pertunjukan seni tradisional, serta eksplorasi alam sekitar desa.",Desa Wisata
https://www.google.com/maps/place/Sungai+Batu+Sei+Gohong/data=!4m7!3m6!1s0x2dfceaa83953c999:0xe2c69aded2c6bb59!8m2!3d-1.9625469!4d113.7532589!16s%2Fg%2F11cs9yplp4!19sChIJmclTOajq_C0RWbvG0t6axuI?authuser=0&hl=id&rclk=1,Sungai Batu Sei Gohong,"4,2",https://lh5.googleusercontent.com/p/AF1QipOLCvM-iORdL0n7QRWJT3I3EOeOQeiJ92adXbbv=w1220-h920-k-no,Kalimantan Tengah,"Kecamatan Bukit Batu, Kota Palangka Raya",Sungai Batu Sei Gohong adalah sungai kecil yang terkenal dengan keindahan alaminya serta suasana tenang di sekitarnya. Tempat ini sering dijadikan lokasi untuk kegiatan memancing atau bersantai sambil menikmati pemandangan sungai dan hutan sekitarnya. Sungai ini juga menjadi habitat bagi berbagai jenis ikan dan satwa liar lainnya.,Lainnya
https://www.google.com/maps/place/Wisata+Batu+Benawa+Pagat/data=!4m7!3m6!1s0x2de56e4c7cac652f:0xc05a85d630d54319!8m2!3d-2.6307128!4d115.4228097!16s%2Fg%2F11b7n_lm52!19sChIJL2WsfExu5S0RGUPVMNaFWsA?authuser=0&hl=id&rclk=1,Wisata Batu Benawa Pagat,"4,2",https://lh5.googleusercontent.com/p/AF1QipOen5mJ-wkMddtuSACQlI_yA5ns1tciG1SUA6R5=w1220-h920-k-no,Kalimantan Tengah,"Kecamatan Pagat , Kabupaten Barito Selatan",Wisata Batu Benawa Pagat adalah destinasi wisata unik dengan formasi batuan besar berbentuk susunan batuan alami . Tempat ini menawarkan pemandangan menawan sekaligus tantangan bagi para pecinta petualangan karena akses menuju lokasi memerlukan trekking melalui jalur alami . Suasana sejuk membuatnya ideal untuk kegiatan outdoor seperti hiking atau piknik bersama teman-teman .,Lainnya
https://www.google.com/maps/place/Taman+Kota+Sampit/data=!4m7!3m6!1s0x2de2bfb5d68ea2e1:0x7bfb69788825b778!8m2!3d-2.5374303!4d112.959974!16s%2Fg%2F11g6nqqh6q!19sChIJ4aKO1rW_4i0ReLcliHhp-3s?authuser=0&hl=id&rclk=1,Taman Kota Sampit,"4,2",https://lh5.googleusercontent.com/p/AF1QipPAgvYE7dxH6TlRhqEUdqfQSWYy-6xwvAvV3xeq=w1220-h920-k-no,Kalimantan Tengah,"Kota Sampit , Kabupaten Kotawaringin Timur","Taman Kota Sampit adalah ruang terbuka hijau di pusat Kota Sampit yang menjadi tempat berkumpul masyarakat setempat serta pengunjung dari luar kota . Taman ini dilengkapi dengan fasilitas seperti jalur jogging , area bermain anak-anak , serta spot untuk bersantai sambil menikmati pemandangan taman yang asri . Suasana taman sangat hidup terutama pada akhir pekan ketika banyak acara komunitas berlangsung di sini .",Taman Rekreasi
